<?xml version="1.0" encoding="UTF-8"?>
<!DOCTYPE alphabet SYSTEM "../alphabet.dtd">
<alphabet name="Polski / Polish" orientation="LR" trainingFilename="training_polish_PL.txt" colorsName="Default">
	<!--Created by: Krzysiek grandysk@go2.pl-->
	<group name="Małe litery">
		<node label="a">
			<textCharAction />
		</node>
		<node label="ą">
			<textCharAction />
		</node>
		<node label="b">
			<textCharAction />
		</node>
		<node label="c">
			<textCharAction />
		</node>
		<node label="ć">
			<textCharAction />
		</node>
		<node label="d">
			<textCharAction />
		</node>
		<node label="e">
			<textCharAction />
		</node>
		<node label="ę">
			<textCharAction />
		</node>
		<node label="f">
			<textCharAction />
		</node>
		<node label="g">
			<textCharAction />
		</node>
		<node label="h">
			<textCharAction />
		</node>
		<node label="i">
			<textCharAction />
		</node>
		<node label="j">
			<textCharAction />
		</node>
		<node label="k">
			<textCharAction />
		</node>
		<node label="l">
			<textCharAction />
		</node>
		<node label="ł">
			<textCharAction />
		</node>
		<node label="m">
			<textCharAction />
		</node>
		<node label="n">
			<textCharAction />
		</node>
		<node label="ń">
			<textCharAction />
		</node>
		<node label="o">
			<textCharAction />
		</node>
		<node label="ó">
			<textCharAction />
		</node>
		<node label="p">
			<textCharAction />
		</node>
		<node label="q">
			<textCharAction />
		</node>
		<node label="r">
			<textCharAction />
		</node>
		<node label="s">
			<textCharAction />
		</node>
		<node label="ś">
			<textCharAction />
		</node>
		<node label="t">
			<textCharAction />
		</node>
		<node label="u">
			<textCharAction />
		</node>
		<node label="v">
			<textCharAction />
		</node>
		<node label="w">
			<textCharAction />
		</node>
		<node label="x">
			<textCharAction />
		</node>
		<node label="y">
			<textCharAction />
		</node>
		<node label="z">
			<textCharAction />
		</node>
		<node label="ź">
			<textCharAction />
		</node>
		<node label="ż">
			<textCharAction />
		</node>
	</group>
	<group name="Duże litery" colorInfoName="duże litery">
		<!--Old Group Color: 111-->
		<node label="A">
			<textCharAction />
		</node>
		<node label="Ą">
			<textCharAction />
		</node>
		<node label="B">
			<textCharAction />
		</node>
		<node label="C">
			<textCharAction />
		</node>
		<node label="Ć">
			<textCharAction />
		</node>
		<node label="D">
			<textCharAction />
		</node>
		<node label="E">
			<textCharAction />
		</node>
		<node label="Ę">
			<textCharAction />
		</node>
		<node label="F">
			<textCharAction />
		</node>
		<node label="G">
			<textCharAction />
		</node>
		<node label="H">
			<textCharAction />
		</node>
		<node label="I">
			<textCharAction />
		</node>
		<node label="J">
			<textCharAction />
		</node>
		<node label="K">
			<textCharAction />
		</node>
		<node label="L">
			<textCharAction />
		</node>
		<node label="Ł">
			<textCharAction />
		</node>
		<node label="M">
			<textCharAction />
		</node>
		<node label="N">
			<textCharAction />
		</node>
		<node label="Ń">
			<textCharAction />
		</node>
		<node label="O">
			<textCharAction />
		</node>
		<node label="Ó">
			<textCharAction />
		</node>
		<node label="P">
			<textCharAction />
		</node>
		<node label="Q">
			<textCharAction />
		</node>
		<node label="R">
			<textCharAction />
		</node>
		<node label="S">
			<textCharAction />
		</node>
		<node label="Ś">
			<textCharAction />
		</node>
		<node label="T">
			<textCharAction />
		</node>
		<node label="U">
			<textCharAction />
		</node>
		<node label="V">
			<textCharAction />
		</node>
		<node label="W">
			<textCharAction />
		</node>
		<node label="X">
			<textCharAction />
		</node>
		<node label="Y">
			<textCharAction />
		</node>
		<node label="Z">
			<textCharAction />
		</node>
		<node label="Ź">
			<textCharAction />
		</node>
		<node label="Ż">
			<textCharAction />
		</node>
	</group>
	<group name="Liczby" colorInfoName="liczby">
		<!--Old Group Color: 113-->
		<node label="0">
			<textCharAction />
		</node>
		<node label="1">
			<textCharAction />
		</node>
		<node label="2">
			<textCharAction />
		</node>
		<node label="3">
			<textCharAction />
		</node>
		<node label="4">
			<textCharAction />
		</node>
		<node label="5">
			<textCharAction />
		</node>
		<node label="6">
			<textCharAction />
		</node>
		<node label="7">
			<textCharAction />
		</node>
		<node label="8">
			<textCharAction />
		</node>
		<node label="9">
			<textCharAction />
		</node>
	</group>
	<group name="Interpunkcja" colorInfoName="interpunkcja">
		<!--Old Group Color: 112-->
		<node label="%">
			<textCharAction />
		</node>
		<node label="*">
			<textCharAction />
		</node>
		<node label="+">
			<textCharAction />
		</node>
		<node label="=">
			<textCharAction />
		</node>
		<node label="/">
			<textCharAction />
		</node>
		<node label="#">
			<textCharAction />
		</node>
		<node label="$">
			<textCharAction />
		</node>
		<node label="|">
			<textCharAction />
		</node>
		<node label="\">
			<textCharAction />
		</node>
		<node label="~">
			<textCharAction />
		</node>
		<node label="^">
			<textCharAction />
		</node>
		<node label="_">
			<textCharAction />
		</node>
		<node label="&amp;">
			<textCharAction />
		</node>
		<node label="@">
			<textCharAction />
		</node>
		<node label="[">
			<textCharAction />
		</node>
		<node label="]">
			<textCharAction />
		</node>
		<node label="{">
			<textCharAction />
		</node>
		<node label="}">
			<textCharAction />
		</node>
		<node label="&lt;">
			<textCharAction />
		</node>
		<node label="&gt;">
			<textCharAction />
		</node>
		<node label="(">
			<textCharAction />
		</node>
		<node label=")">
			<textCharAction />
		</node>
		<node label="‹">
			<!--Note: French left single quotation mark-->
			<textCharAction />
		</node>
		<node label="›">
			<!--Note: French right single quotation mark-->
			<textCharAction />
		</node>
		<node label="«">
			<!--Note: French left double quotation mark-->
			<textCharAction />
		</node>
		<node label="»">
			<!--Note: French right double quotation mark-->
			<textCharAction />
		</node>
		<node label="&quot;">
			<textCharAction />
		</node>
		<node label="`">
			<textCharAction />
		</node>
		<node label="'">
			<textCharAction />
		</node>
		<node label="-">
			<textCharAction />
		</node>
		<node label=":">
			<textCharAction />
		</node>
		<node label=";">
			<textCharAction />
		</node>
		<node label="?">
			<textCharAction />
		</node>
		<node label="!">
			<textCharAction />
		</node>
		<node label=",">
			<textCharAction />
		</node>
		<node label=".">
			<textCharAction />
		</node>
	</group>
	<group name="paragraphSpace" colorInfoName="paragraphSpace">
		<node label="¶">
			<!--Old Char Color: 9-->
			<textCharAction />
		</node>
		<node label="□">
			<!--Old Char Color: 9-->
			<!--Note: box-->
			<textCharAction unicode="32" />
		</node>
	</group>
</alphabet>