<?xml version="1.0" encoding="UTF-8"?>
<!DOCTYPE alphabet SYSTEM "../alphabet.dtd">
<alphabet name="Russian (Русский) - Кириллица alphabet" orientation="LR" trainingFilename="training_russian_RU.txt" colorsName="Default">
	<group name="lower case cyrillic (Кириллица) letters">
		<node label="а">
			<textCharAction />
		</node>
		<node label="б">
			<textCharAction />
		</node>
		<node label="в">
			<textCharAction />
		</node>
		<node label="г">
			<textCharAction />
		</node>
		<node label="д">
			<textCharAction />
		</node>
		<node label="е">
			<textCharAction />
		</node>
		<!-- <s d="&#x0450;" t="&#x0450;" note="not found in training text" /> -->
		<node label="ё">
			<!--Note: e with two dots - should this be 0407?-->
			<textCharAction />
		</node>
		<node label="ж">
			<textCharAction />
		</node>
		<node label="з">
			<textCharAction />
		</node>
		<node label="и">
			<textCharAction />
		</node>
		<node label="й">
			<textCharAction />
		</node>
		<node label="к">
			<textCharAction />
		</node>
		<node label="л">
			<textCharAction />
		</node>
		<node label="м">
			<textCharAction />
		</node>
		<node label="н">
			<textCharAction />
		</node>
		<node label="о">
			<textCharAction />
		</node>
		<node label="п">
			<textCharAction />
		</node>
		<node label="р">
			<textCharAction />
		</node>
		<node label="с">
			<textCharAction />
		</node>
		<node label="т">
			<textCharAction />
		</node>
		<node label="у">
			<textCharAction />
		</node>
		<node label="ф">
			<textCharAction />
		</node>
		<node label="х">
			<textCharAction />
		</node>
		<node label="ц">
			<textCharAction />
		</node>
		<node label="ч">
			<textCharAction />
		</node>
		<node label="ш">
			<textCharAction />
		</node>
		<node label="щ">
			<textCharAction />
		</node>
		<node label="ъ">
			<textCharAction />
		</node>
		<node label="ы">
			<textCharAction />
		</node>
		<node label="ь">
			<textCharAction />
		</node>
		<node label="э">
			<textCharAction />
		</node>
		<node label="ю">
			<textCharAction />
		</node>
		<node label="я">
			<textCharAction />
		</node>
	</group>
	<group name="upper case cyrillic (Кириллица) letters" colorInfoName="upper case cyrillic (кириллица) letters">
		<!--Old Group Color: 111-->
		<node label="А">
			<textCharAction />
		</node>
		<node label="Б">
			<textCharAction />
		</node>
		<node label="В">
			<textCharAction />
		</node>
		<node label="Г">
			<textCharAction />
		</node>
		<node label="Д">
			<textCharAction />
		</node>
		<node label="Е">
			<textCharAction />
		</node>
		<!-- <s d="&#x0400;" t="&#x0400;" note="not found in training text"  /> -->
		<node label="Ё">
			<!--Note: E with two dots - should this be 0406? -->
			<textCharAction />
		</node>
		<node label="Ж">
			<textCharAction />
		</node>
		<node label="З">
			<textCharAction />
		</node>
		<node label="И">
			<textCharAction />
		</node>
		<node label="Й">
			<textCharAction />
		</node>
		<node label="К">
			<textCharAction />
		</node>
		<node label="Л">
			<textCharAction />
		</node>
		<node label="М">
			<textCharAction />
		</node>
		<node label="Н">
			<textCharAction />
		</node>
		<node label="О">
			<textCharAction />
		</node>
		<node label="П">
			<textCharAction />
		</node>
		<node label="Р">
			<textCharAction />
		</node>
		<node label="С">
			<textCharAction />
		</node>
		<node label="Т">
			<textCharAction />
		</node>
		<node label="У">
			<textCharAction />
		</node>
		<node label="Ф">
			<textCharAction />
		</node>
		<node label="Х">
			<textCharAction />
		</node>
		<node label="Ц">
			<textCharAction />
		</node>
		<node label="Ч">
			<textCharAction />
		</node>
		<node label="Ш">
			<textCharAction />
		</node>
		<node label="Щ">
			<textCharAction />
		</node>
		<node label="Ъ">
			<textCharAction />
		</node>
		<node label="Ы">
			<textCharAction />
		</node>
		<node label="Ь">
			<textCharAction />
		</node>
		<node label="Э">
			<textCharAction />
		</node>
		<node label="Ю">
			<textCharAction />
		</node>
		<node label="Я">
			<textCharAction />
		</node>
	</group>
	<group name="Numbers" colorInfoName="numbers">
		<!--Old Group Color: 113-->
		<node label="1">
			<textCharAction />
		</node>
		<node label="2">
			<textCharAction />
		</node>
		<node label="3">
			<textCharAction />
		</node>
		<node label="4">
			<textCharAction />
		</node>
		<node label="5">
			<textCharAction />
		</node>
		<node label="6">
			<textCharAction />
		</node>
		<node label="7">
			<textCharAction />
		</node>
		<node label="8">
			<textCharAction />
		</node>
		<node label="9">
			<textCharAction />
		</node>
		<node label="0">
			<textCharAction />
		</node>
	</group>
	<group name="Punctuation" colorInfoName="punctuation">
		<!--Old Group Color: 112-->
		<node label="%">
			<textCharAction />
		</node>
		<node label="*">
			<textCharAction />
		</node>
		<node label="+">
			<textCharAction />
		</node>
		<node label="=">
			<textCharAction />
		</node>
		<node label="/">
			<textCharAction />
		</node>
		<node label="#">
			<textCharAction />
		</node>
		<node label="$">
			<textCharAction />
		</node>
		<node label="|">
			<textCharAction />
		</node>
		<node label="\">
			<textCharAction />
		</node>
		<node label="~">
			<textCharAction />
		</node>
		<node label="^">
			<textCharAction />
		</node>
		<node label="_">
			<textCharAction />
		</node>
		<node label="&amp;">
			<textCharAction />
		</node>
		<node label="@">
			<textCharAction />
		</node>
		<node label="[">
			<textCharAction />
		</node>
		<node label="]">
			<textCharAction />
		</node>
		<node label="{">
			<textCharAction />
		</node>
		<node label="}">
			<textCharAction />
		</node>
		<node label="&lt;">
			<textCharAction />
		</node>
		<node label="&gt;">
			<textCharAction />
		</node>
		<node label="(">
			<textCharAction />
		</node>
		<node label=")">
			<textCharAction />
		</node>
		<node label="‹">
			<!--Note: French left single quotation mark-->
			<textCharAction />
		</node>
		<node label="›">
			<!--Note: French right single quotation mark-->
			<textCharAction />
		</node>
		<node label="«">
			<!--Note: French left double quotation mark-->
			<textCharAction />
		</node>
		<node label="»">
			<!--Note: French right double quotation mark-->
			<textCharAction />
		</node>
		<node label="&quot;">
			<textCharAction />
		</node>
		<node label="`">
			<textCharAction />
		</node>
		<node label="'">
			<textCharAction />
		</node>
		<node label="-">
			<textCharAction />
		</node>
		<node label=":">
			<textCharAction />
		</node>
		<node label=";">
			<textCharAction />
		</node>
		<node label="?">
			<textCharAction />
		</node>
		<node label="!">
			<textCharAction />
		</node>
		<node label=",">
			<textCharAction />
		</node>
		<node label=".">
			<textCharAction />
		</node>
	</group>
	<group name="paragraphSpace" colorInfoName="paragraphSpace">
		<node label="¶">
			<!--Old Char Color: 9-->
			<textCharAction />
		</node>
		<node label="□">
			<!--Old Char Color: 9-->
			<textCharAction unicode="32" />
		</node>
	</group>
</alphabet>