<?xml version="1.0" encoding="UTF-8"?>
<!DOCTYPE alphabet SYSTEM "../alphabet.dtd">
<alphabet name="Kannada with punctuation and numerals" orientation="LR" trainingFilename="training_Kannada_IN.txt" colorsName="Default">
	<group name="KANNADA  letters">
		<node label="ಅ">
			<!--Note: KANNADA LETTER A -->
			<textCharAction />
		</node>
		<node label="ಆ">
			<!--Note: KANNADA LETTER AA -->
			<textCharAction />
		</node>
		<node label="ಇ">
			<!--Note: KANNADA LETTER I -->
			<textCharAction />
		</node>
		<node label="ಈ">
			<!--Note: KANNADA LETTER II -->
			<textCharAction />
		</node>
		<node label="ಉ">
			<!--Note: KANNADA LETTER U -->
			<textCharAction />
		</node>
		<node label="ಊ">
			<!--Note: KANNADA LETTER UU -->
			<textCharAction />
		</node>
		<node label="ಋ">
			<!--Note: KANNADA LETTER VOCALIC R -->
			<textCharAction />
		</node>
		<node label="ೠ">
			<!--Note: KANNADA LETTER VOCALIC RR -->
			<textCharAction />
		</node>
		<node label="ಌ">
			<!--Note: KANNADA LETTER VOCALIC L -->
			<textCharAction />
		</node>
		<node label="ೡ">
			<!--Note: KANNADA LETTER VOCALIC LL -->
			<textCharAction />
		</node>
		<node label="ಎ">
			<!--Note: KANNADA LETTER E -->
			<textCharAction />
		</node>
		<node label="ಏ">
			<!--Note: KANNADA LETTER EE -->
			<textCharAction />
		</node>
		<node label="ಐ">
			<!--Note: KANNADA LETTER AI -->
			<textCharAction />
		</node>
		<node label="ಒ">
			<!--Note: KANNADA LETTER O -->
			<textCharAction />
		</node>
		<node label="ಓ">
			<!--Note: KANNADA LETTER OO -->
			<textCharAction />
		</node>
		<node label="ಔ">
			<!--Note: KANNADA LETTER AU -->
			<textCharAction />
		</node>
		<node label="ಕ">
			<!--Note: KANNADA LETTER KA -->
			<textCharAction />
		</node>
		<node label="ಖ">
			<!--Note: KANNADA LETTER KHA -->
			<textCharAction />
		</node>
		<node label="ಗ">
			<!--Note: KANNADA LETTER GA -->
			<textCharAction />
		</node>
		<node label="ಘ">
			<!--Note: KANNADA LETTER GHA -->
			<textCharAction />
		</node>
		<node label="ಙ">
			<!--Note: KANNADA LETTER NGA -->
			<textCharAction />
		</node>
		<node label="ಚ">
			<!--Note: KANNADA LETTER CA -->
			<textCharAction />
		</node>
		<node label="ಛ">
			<!--Note: KANNADA LETTER CHA -->
			<textCharAction />
		</node>
		<node label="ಜ">
			<!--Note: KANNADA LETTER JA -->
			<textCharAction />
		</node>
		<node label="ಝ">
			<!--Note: KANNADA LETTER JHA -->
			<textCharAction />
		</node>
		<node label="ಞ">
			<!--Note: KANNADA LETTER NYA -->
			<textCharAction />
		</node>
		<node label="ಟ">
			<!--Note: KANNADA LETTER TTA -->
			<textCharAction />
		</node>
		<node label="ಠ">
			<!--Note: KANNADA LETTER TTHA -->
			<textCharAction />
		</node>
		<node label="ಡ">
			<!--Note: KANNADA LETTER DDA -->
			<textCharAction />
		</node>
		<node label="ಢ">
			<!--Note: KANNADA LETTER DDHA -->
			<textCharAction />
		</node>
		<node label="ಣ">
			<!--Note: KANNADA LETTER NNA -->
			<textCharAction />
		</node>
		<node label="ತ">
			<!--Note: KANNADA LETTER TA -->
			<textCharAction />
		</node>
		<node label="ಥ">
			<!--Note: KANNADA LETTER THA -->
			<textCharAction />
		</node>
		<node label="ದ">
			<!--Note: KANNADA LETTER DA -->
			<textCharAction />
		</node>
		<node label="ಧ">
			<!--Note: KANNADA LETTER DHA -->
			<textCharAction />
		</node>
		<node label="ನ">
			<!--Note: KANNADA LETTER NA -->
			<textCharAction />
		</node>
		<node label="ಪ">
			<!--Note: KANNADA LETTER PA -->
			<textCharAction />
		</node>
		<node label="ಫ">
			<!--Note: KANNADA LETTER PHA -->
			<textCharAction />
		</node>
		<node label="ಬ">
			<!--Note: KANNADA LETTER BA -->
			<textCharAction />
		</node>
		<node label="ಭ">
			<!--Note: KANNADA LETTER BHA -->
			<textCharAction />
		</node>
		<node label="ಮ">
			<!--Note: KANNADA LETTER MA -->
			<textCharAction />
		</node>
		<node label="ಯ">
			<!--Note: KANNADA LETTER YA -->
			<textCharAction />
		</node>
		<node label="ರ">
			<!--Note: KANNADA LETTER RA -->
			<textCharAction />
		</node>
		<node label="ಱ">
			<!--Note: KANNADA LETTER RRA -->
			<textCharAction />
		</node>
		<node label="ಲ">
			<!--Note: KANNADA LETTER LA -->
			<textCharAction />
		</node>
		<node label="ವ">
			<!--Note: KANNADA LETTER VA -->
			<textCharAction />
		</node>
		<node label="ಶ">
			<!--Note: KANNADA LETTER SHA -->
			<textCharAction />
		</node>
		<node label="ಷ">
			<!--Note: KANNADA LETTER SSA -->
			<textCharAction />
		</node>
		<node label="ಸ">
			<!--Note: KANNADA LETTER SA -->
			<textCharAction />
		</node>
		<node label="ಹ">
			<!--Note: KANNADA LETTER HA -->
			<textCharAction />
		</node>
		<node label="ಽ">
			<!--Note: KANNADA SIGN AVAGRAHA -->
			<textCharAction />
		</node>
		<node label="ಳ">
			<!--Note: KANNADA LETTER LLA -->
			<textCharAction />
		</node>
		<node label="ೞ">
			<!--Note: KANNADA LETTER FA -->
			<textCharAction />
		</node>
	</group>
	<group name="Kannada vowel signs and other marks" colorInfoName="kannada vowel signs and other marks">
		<!--Old Group Color: 111-->
		<node label="◌ಾ">
			<!--Note: KANNADA VOWEL SIGN AA -->
			<textCharAction unicode="3262" />
		</node>
		<node label="◌ಿ">
			<!--Note: KANNADA VOWEL SIGN I -->
			<textCharAction unicode="3263" />
		</node>
		<node label="◌ೀ">
			<!--Note: KANNADA VOWEL SIGN II -->
			<textCharAction unicode="3264" />
		</node>
		<node label="◌ು">
			<!--Note: KANNADA VOWEL SIGN U -->
			<textCharAction unicode="3265" />
		</node>
		<node label="◌ೂ">
			<!--Note: KANNADA VOWEL SIGN UU -->
			<textCharAction unicode="3266" />
		</node>
		<node label="◌ೃ">
			<!--Note: KANNADA VOWEL SIGN VOCALIC R -->
			<textCharAction unicode="3267" />
		</node>
		<node label="◌ೄ">
			<!--Note: KANNADA VOWEL SIGN VOCALIC RR -->
			<textCharAction unicode="3268" />
		</node>
		<node label="◌ೆ">
			<!--Note: KANNADA VOWEL SIGN E -->
			<textCharAction unicode="3270" />
		</node>
		<node label="◌ೇ">
			<!--Note: KANNADA VOWEL SIGN EE -->
			<textCharAction unicode="3271" />
		</node>
		<node label="◌ೈ">
			<!--Note: KANNADA VOWEL SIGN AI -->
			<textCharAction unicode="3272" />
		</node>
		<node label="◌ೊ">
			<!--Note: KANNADA VOWEL SIGN O -->
			<textCharAction unicode="3274" />
		</node>
		<node label="◌ೋ">
			<!--Note: KANNADA VOWEL SIGN OO -->
			<textCharAction unicode="3275" />
		</node>
		<node label="◌ೌ">
			<!--Note: KANNADA VOWEL SIGN AU -->
			<textCharAction unicode="3276" />
		</node>
		<node label="◌್">
			<!--Note: KANNADA SIGN VIRAMA -->
			<textCharAction unicode="3277" />
		</node>
		<node label="◌ೕ">
			<!--Note: KANNADA LENGTH MARK -->
			<textCharAction unicode="3285" />
		</node>
		<node label="◌ೖ">
			<!--Note: KANNADA AI LENGTH MARK -->
			<textCharAction unicode="3286" />
		</node>
	</group>
	<group name="Numbers" colorInfoName="numbers">
		<!--Old Group Color: 113-->
		<node label="1">
			<textCharAction />
		</node>
		<node label="2">
			<textCharAction />
		</node>
		<node label="3">
			<textCharAction />
		</node>
		<node label="4">
			<textCharAction />
		</node>
		<node label="5">
			<textCharAction />
		</node>
		<node label="6">
			<textCharAction />
		</node>
		<node label="7">
			<textCharAction />
		</node>
		<node label="8">
			<textCharAction />
		</node>
		<node label="9">
			<textCharAction />
		</node>
		<node label="0">
			<textCharAction />
		</node>
	</group>
	<group name="Punctuation" colorInfoName="punctuation">
		<!--Old Group Color: 112-->
		<node label="%">
			<textCharAction />
		</node>
		<node label="*">
			<textCharAction />
		</node>
		<node label="+">
			<textCharAction />
		</node>
		<node label="=">
			<textCharAction />
		</node>
		<node label="/">
			<textCharAction />
		</node>
		<node label="#">
			<textCharAction />
		</node>
		<node label="$">
			<textCharAction />
		</node>
		<node label="|">
			<textCharAction />
		</node>
		<node label="\">
			<textCharAction />
		</node>
		<node label="~">
			<textCharAction />
		</node>
		<node label="^">
			<textCharAction />
		</node>
		<node label="_">
			<textCharAction />
		</node>
		<node label="&amp;">
			<textCharAction />
		</node>
		<node label="@">
			<textCharAction />
		</node>
		<node label="[">
			<textCharAction />
		</node>
		<node label="]">
			<textCharAction />
		</node>
		<node label="{">
			<textCharAction />
		</node>
		<node label="}">
			<textCharAction />
		</node>
		<node label="&lt;">
			<textCharAction />
		</node>
		<node label="&gt;">
			<textCharAction />
		</node>
		<node label="(">
			<textCharAction />
		</node>
		<node label=")">
			<textCharAction />
		</node>
		<node label="&quot;">
			<textCharAction />
		</node>
		<node label="`">
			<textCharAction />
		</node>
		<node label="'">
			<textCharAction />
		</node>
		<node label="-">
			<textCharAction />
		</node>
		<node label=":">
			<textCharAction />
		</node>
		<node label=";">
			<textCharAction />
		</node>
		<node label="?">
			<textCharAction />
		</node>
		<node label="!">
			<textCharAction />
		</node>
		<node label=",">
			<textCharAction />
		</node>
		<node label="·">
			<textCharAction unicode="46" />
		</node>
	</group>
	<group name="paragraphSpace" colorInfoName="paragraphSpace">
		<node label="¶">
			<!--Old Char Color: 9-->
			<textCharAction />
		</node>
		<node label="□">
			<!--Old Char Color: 9-->
			<!--Note: box-->
			<textCharAction unicode="32" />
		</node>
	</group>
</alphabet>